2024-12-14 02:42:34,915 - Captured packet: udp - Ether / IP / UDP 185.73.194.77:https > 192.168.0.103:65466 / Raw
2024-12-14 02:42:35,031 - Captured packet: udp - Ether / IP / UDP 192.168.0.103:65466 > 185.73.194.77:https / Raw
2024-12-14 02:42:35,140 - Captured packet: udp - Ether / IP / UDP 185.73.194.77:https > 192.168.0.103:65466 / Raw
2024-12-14 02:42:35,250 - Captured packet: udp - Ether / IP / UDP 192.168.0.103:65466 > 185.73.194.77:https / Raw
2024-12-14 02:42:35,450 - Captured packet: tcp - Ether / IP / TCP 192.168.0.103:52805 > 74.125.205.139:https PA / Raw
2024-12-14 02:42:35,558 - Captured packet: tcp - Ether / IP / TCP 192.168.0.103:52804 > 74.125.205.139:https PA / Raw
2024-12-14 02:42:35,792 - Captured packet: tcp - Ether / IP / TCP 192.168.0.103:52798 > 185.73.194.77:https FA
2024-12-14 02:42:35,895 - Captured packet: tcp - Ether / IP / TCP 192.168.0.103:52806 > 176.124.217.181:52432 FA
2024-12-14 02:42:36,008 - Captured packet: tcp - Ether / IP / TCP 192.168.0.103:52713 > 93.158.134.119:https FA
2024-12-14 02:42:36,117 - Captured packet: tcp - Ether / IP / TCP 185.73.194.77:https > 192.168.0.103:52798 FA
2024-12-14 02:42:36,222 - Captured packet: tcp - Ether / IP / TCP 192.168.0.103:52798 > 185.73.194.77:https A
2024-12-14 02:42:36,328 - Captured packet: tcp - Ether / IP / TCP 93.158.134.119:https > 192.168.0.103:52713 PA / Raw
2024-12-14 02:42:36,437 - Captured packet: tcp - Ether / IP / TCP 93.158.134.119:https > 192.168.0.103:52713 PA / Raw
2024-12-14 02:42:36,546 - Captured packet: tcp - Ether / IP / TCP 192.168.0.103:52713 > 93.158.134.119:https RA
2024-12-14 02:42:36,656 - Captured packet: tcp - Ether / IP / TCP 93.158.134.119:https > 192.168.0.103:52713 FA
2024-12-14 02:42:36,772 - Captured packet: tcp - Ether / IP / TCP 176.124.217.181:52432 > 192.168.0.103:52806 FA
2024-12-14 02:42:36,897 - Captured packet: tcp - Ether / IP / TCP 192.168.0.103:52806 > 176.124.217.181:52432 A
2024-12-14 02:42:37,015 - Captured packet: tcp - Ether / IP / TCP 192.168.0.103:52784 > 104.208.16.90:https FA
2024-12-14 02:42:37,124 - Captured packet: tcp - Ether / IP / TCP 104.208.16.90:https > 192.168.0.103:52784 FA
2024-12-14 02:42:37,234 - Captured packet: tcp - Ether / IP / TCP 192.168.0.103:52784 > 104.208.16.90:https A
2024-12-14 02:42:37,345 - Captured packet: udp - Ether / IP / UDP 192.168.0.103:65466 > 185.73.194.77:https / Raw
2024-12-14 02:42:37,455 - Captured packet: udp - Ether / IP / UDP 192.168.0.103:65466 > 185.73.194.77:https / Raw
2024-12-14 02:42:37,572 - Captured packet: udp - Ether / IP / UDP 185.73.194.77:https > 192.168.0.103:65466 / Raw
2024-12-14 02:42:37,681 - Captured packet: udp - Ether / IP / UDP 185.73.194.77:https > 192.168.0.103:65466 / Raw
2024-12-14 02:42:37,791 - Captured packet: udp - Ether / IP / UDP 192.168.0.103:65466 > 185.73.194.77:https / Raw
2024-12-14 02:42:37,901 - Captured packet: udp - Ether / IP / UDP 185.73.194.77:https > 192.168.0.103:65466 / Raw
2024-12-14 02:42:38,019 - Captured packet: udp - Ether / IP / UDP 192.168.0.103:65466 > 185.73.194.77:https / Raw
2024-12-14 02:42:38,128 - Captured packet: udp - Ether / IP / UDP 185.73.194.77:https > 192.168.0.103:65466 / Raw
2024-12-14 02:42:38,238 - Captured packet: udp - Ether / IP / UDP 192.168.0.103:65466 > 185.73.194.77:https / Raw
2024-12-14 02:42:40,263 - Captured packet: tcp - Ether / IP / TCP 192.168.0.103:52805 > 74.125.205.139:https PA / Raw
2024-12-14 02:42:40,377 - Captured packet: tcp - Ether / IP / TCP 192.168.0.103:52804 > 74.125.205.139:https PA / Raw
2024-12-14 02:42:41,217 - Captured packet: tcp - Ether / IP / TCP 212.41.1.7:https > 192.168.0.103:51071 PA / Raw
2024-12-14 02:42:41,342 - Captured packet: tcp - Ether / IP / TCP 192.168.0.103:51071 > 212.41.1.7:https A
2024-12-14 02:42:41,963 - Captured packet: tcp - Ether / IP / TCP 192.168.0.103:52797 > 45.152.183.238:https A / Raw
2024-12-14 02:42:42,073 - Captured packet: tcp - Ether / IP / TCP 45.152.183.238:https > 192.168.0.103:52797 A
2024-12-14 02:42:42,303 - Captured packet: tcp - Ether / IP / TCP 192.168.0.103:52807 > 74.125.205.139:https S
2024-12-14 02:42:42,428 - Captured packet: tcp - Ether / IP / TCP 74.125.205.139:https > 192.168.0.103:52807 SA
2024-12-14 02:42:42,538 - Captured packet: tcp - Ether / IP / TCP 192.168.0.103:52807 > 74.125.205.139:https A
2024-12-14 02:42:42,642 - Captured packet: tcp - Ether / IP / TCP 192.168.0.103:52807 > 74.125.205.139:https PA / Raw
2024-12-14 02:42:42,748 - Captured packet: tcp - Ether / IP / TCP 192.168.0.103:52796 > 45.152.183.238:https A / Raw
2024-12-14 02:42:42,857 - Captured packet: tcp - Ether / IP / TCP 192.168.0.103:52807 > 74.125.205.139:https PA / Raw
2024-12-14 02:42:42,966 - Captured packet: tcp - Ether / IP / TCP 45.152.183.238:https > 192.168.0.103:52796 A
2024-12-14 02:42:43,075 - Captured packet: ?? - Ether / ARP who has 192.168.0.103 says 192.168.0.1
2024-12-14 02:42:43,182 - Captured packet: ?? - Ether / ARP is at ec:2e:98:4e:60:cd says 192.168.0.103
2024-12-14 02:42:43,307 - Captured packet: tcp - Ether / IP / TCP 192.168.0.103:52807 > 74.125.205.139:https PA / Raw
2024-12-14 02:42:43,515 - Captured packet: tcp - Ether / IP / TCP 192.168.0.103:52807 > 74.125.205.139:https PA / Raw
2024-12-14 02:42:44,739 - Captured packet: tcp - Ether / IP / TCP 192.168.0.103:52807 > 74.125.205.139:https PA / Raw
2024-12-14 02:42:45,042 - Captured packet: tcp - Ether / IP / TCP 192.168.0.103:52779 > 104.76.26.52:https FA
2024-12-14 02:42:45,162 - Captured packet: tcp - Ether / IP / TCP 104.76.26.52:https > 192.168.0.103:52779 PA / Raw
2024-12-14 02:42:45,271 - Captured packet: tcp - Ether / IP / TCP 192.168.0.103:52779 > 104.76.26.52:https RA
2024-12-14 02:42:45,380 - Captured packet: tcp - Ether / IP / TCP 104.76.26.52:https > 192.168.0.103:52779 FA
2024-12-14 02:42:47,152 - Captured packet: tcp - Ether / IP / TCP 192.168.0.103:52807 > 74.125.205.139:https PA / Raw
2024-12-14 02:42:48,269 - Captured packet: ?? - Ether / ARP who has 192.168.0.1 says 192.168.0.103
2024-12-14 02:42:48,379 - Captured packet: ?? - Ether / ARP is at bc:0f:9a:24:a1:78 says 192.168.0.1
2024-12-14 02:42:49,483 - Captured packet: tcp - Ether / IP / TCP 192.168.0.103:52658 > 35.190.80.1:https A / Raw
2024-12-14 02:42:49,606 - Captured packet: tcp - Ether / IP / TCP 35.190.80.1:https > 192.168.0.103:52658 A
2024-12-14 02:42:49,715 - Captured packet: tcp - Ether / IP / TCP 192.168.0.103:62882 > 149.154.167.50:https PA / Raw
2024-12-14 02:42:49,824 - Captured packet: tcp - Ether / IP / TCP 149.154.167.50:https > 192.168.0.103:62882 A
2024-12-14 02:46:06,676 - Captured packet: tcp - Ether / IP / TCP 192.168.0.103:52816 > 45.152.183.238:https A / Raw
2024-12-14 02:46:06,788 - Captured packet: tcp - Ether / IP / TCP 45.152.183.238:https > 192.168.0.103:52816 A
2024-12-14 02:46:09,336 - Captured packet: udp - Ether / IP / UDP / DNS Qry b'play.google.com.'
2024-12-14 02:46:09,445 - Captured packet: udp - Ether / IP / UDP / DNS Qry b'play.google.com.'
2024-12-14 02:46:09,555 - Captured packet: udp - Ether / IP / UDP / DNS Ans 74.125.205.102
2024-12-14 02:46:09,672 - Captured packet: udp - Ether / IP / UDP / DNS Ans
2024-12-14 02:46:09,780 - Captured packet: tcp - Ether / IP / TCP 192.168.0.103:52851 > 74.125.205.102:https S
2024-12-14 02:46:09,890 - Captured packet: tcp - Ether / IP / TCP 74.125.205.102:https > 192.168.0.103:52851 SA
2024-12-14 02:46:09,999 - Captured packet: tcp - Ether / IP / TCP 192.168.0.103:52851 > 74.125.205.102:https A
2024-12-14 02:47:32,794 - Captured packet: ?? - Ether / ARP who has 192.168.0.1 says 192.168.0.103
2024-12-14 02:47:32,906 - Captured packet: ?? - Ether / ARP is at bc:0f:9a:24:a1:78 says 192.168.0.1
2024-12-14 02:47:34,077 - Captured packet: tcp - Ether / IP / TCP 192.168.0.103:52865 > 74.125.205.102:https RA
2024-12-14 02:47:36,457 - Captured packet: tcp - Ether / IP / TCP 192.168.0.103:52869 > 74.125.205.102:https PA / Raw
2024-12-14 02:47:37,740 - Captured packet: ?? - Ether / IPv6 / UDP / DNS Qry b'sp181.npvu.me.'
2024-12-14 02:47:37,851 - Captured packet: ?? - Ether / IPv6 / UDP / DNS Ans 45.152.183.238
2024-12-14 02:47:37,960 - Captured packet: tcp - Ether / IP / TCP 192.168.0.103:52870 > 45.152.183.238:https S
2024-12-14 02:47:38,069 - Captured packet: tcp - Ether / IP / TCP 45.152.183.238:https > 192.168.0.103:52870 SA
2024-12-14 02:47:38,171 - Captured packet: tcp - Ether / IP / TCP 192.168.0.103:52870 > 45.152.183.238:https A
2024-12-14 02:47:38,283 - Captured packet: tcp - Ether / IP / TCP 192.168.0.103:52870 > 45.152.183.238:https A / Raw
2024-12-14 02:47:38,392 - Captured packet: tcp - Ether / IP / TCP 192.168.0.103:52870 > 45.152.183.238:https PA / Raw
2024-12-14 02:47:38,502 - Captured packet: tcp - Ether / IP / TCP 45.152.183.238:https > 192.168.0.103:52870 A
2024-12-14 02:47:38,611 - Captured packet: tcp - Ether / IP / TCP 45.152.183.238:https > 192.168.0.103:52870 A
2024-12-14 02:47:38,720 - Captured packet: tcp - Ether / IP / TCP 45.152.183.238:https > 192.168.0.103:52870 A / Raw
2024-12-14 02:47:38,836 - Captured packet: tcp - Ether / IP / TCP 45.152.183.238:https > 192.168.0.103:52870 PA / Raw
2024-12-14 02:47:38,948 - Captured packet: tcp - Ether / IP / TCP 192.168.0.103:52870 > 45.152.183.238:https A
2024-12-14 02:47:39,058 - Captured packet: tcp - Ether / IP / TCP 192.168.0.103:52870 > 45.152.183.238:https PA / Raw
2024-12-14 02:47:39,167 - Captured packet: tcp - Ether / IP / TCP 45.152.183.238:https > 192.168.0.103:52870 PA / Raw
2024-12-14 02:47:39,280 - Captured packet: tcp - Ether / IP / TCP 192.168.0.103:52870 > 45.152.183.238:https PA / Raw
2024-12-14 02:47:39,391 - Captured packet: tcp - Ether / IP / TCP 45.152.183.238:https > 192.168.0.103:52870 PA / Raw
2024-12-14 02:47:39,502 - Captured packet: tcp - Ether / IP / TCP 192.168.0.103:52870 > 45.152.183.238:https A / Raw
2024-12-14 02:47:39,611 - Captured packet: tcp - Ether / IP / TCP 192.168.0.103:52870 > 45.152.183.238:https PA / Raw
2024-12-14 02:47:39,721 - Captured packet: tcp - Ether / IP / TCP 45.152.183.238:https > 192.168.0.103:52870 A
2024-12-14 02:47:39,825 - Captured packet: tcp - Ether / IP / TCP 45.152.183.238:https > 192.168.0.103:52870 PA / Raw
2024-12-14 02:47:39,935 - Captured packet: tcp - Ether / IP / TCP 192.168.0.103:52870 > 45.152.183.238:https PA / Raw
2024-12-14 02:47:40,045 - Captured packet: tcp - Ether / IP / TCP 45.152.183.238:https > 192.168.0.103:52870 PA / Raw
2024-12-14 02:47:40,154 - Captured packet: tcp - Ether / IP / TCP 192.168.0.103:52870 > 45.152.183.238:https A
2024-12-14 02:47:40,269 - Captured packet: udp - Ether / IP / UDP / DNS Qry b'xapi.ozon.ru.'
2024-12-14 02:47:40,381 - Captured packet: udp - Ether / IP / UDP / DNS Qry b'xapi.ozon.ru.'
2024-12-14 02:47:40,491 - Captured packet: udp - Ether / IP / UDP / DNS Ans b'edge-lb-g5.ozon.ru.'
2024-12-14 02:47:40,605 - Captured packet: udp - Ether / IP / UDP / DNS Ans b'edge-lb-g5.ozon.ru.'
2024-12-14 02:47:40,725 - Captured packet: udp - Ether / IP / UDP 192.168.0.103:49883 > 185.73.195.108:https / Raw
2024-12-14 02:47:40,834 - Captured packet: tcp - Ether / IP / TCP 192.168.0.103:52871 > 185.73.195.108:https S
2024-12-14 02:47:40,943 - Captured packet: udp - Ether / IP / UDP 185.73.195.108:https > 192.168.0.103:49883 / Raw
2024-12-14 02:47:41,053 - Captured packet: udp - Ether / IP / UDP 185.73.195.108:https > 192.168.0.103:49883 / Raw
2024-12-14 02:47:41,160 - Captured packet: udp - Ether / IP / UDP 185.73.195.108:https > 192.168.0.103:49883 / Raw
2024-12-14 02:47:41,269 - Captured packet: udp - Ether / IP / UDP 185.73.195.108:https > 192.168.0.103:49883 / Raw
2024-12-14 02:47:41,378 - Captured packet: udp - Ether / IP / UDP 192.168.0.103:49883 > 185.73.195.108:https / Raw
2024-12-14 02:47:41,512 - Captured packet: udp - Ether / IP / UDP 192.168.0.103:49883 > 185.73.195.108:https / Raw
2024-12-14 02:47:41,623 - Captured packet: udp - Ether / IP / UDP 192.168.0.103:49883 > 185.73.195.108:https / Raw
2024-12-14 02:47:41,733 - Captured packet: udp - Ether / IP / UDP 185.73.195.108:https > 192.168.0.103:49883 / Raw
2024-12-14 02:47:41,842 - Captured packet: udp - Ether / IP / UDP 192.168.0.103:49883 > 185.73.195.108:https / Raw
2024-12-14 02:47:41,954 - Captured packet: udp - Ether / IP / UDP 192.168.0.103:49883 > 185.73.195.108:https / Raw
2024-12-14 02:47:42,070 - Captured packet: udp - Ether / IP / UDP 192.168.0.103:49883 > 185.73.195.108:https / Raw
2024-12-14 02:47:42,180 - Captured packet: tcp - Ether / IP / TCP 185.73.195.108:https > 192.168.0.103:52871 SA
2024-12-14 02:47:42,293 - Captured packet: tcp - Ether / IP / TCP 192.168.0.103:52871 > 185.73.195.108:https A
2024-12-14 02:47:42,403 - Captured packet: tcp - Ether / IP / TCP 192.168.0.103:52871 > 185.73.195.108:https PA / Raw
2024-12-14 02:47:42,518 - Captured packet: udp - Ether / IP / UDP 185.73.195.108:https > 192.168.0.103:49883 / Raw
2024-12-14 02:47:42,628 - Captured packet: udp - Ether / IP / UDP 185.73.195.108:https > 192.168.0.103:49883 / Raw
2024-12-14 02:47:42,737 - Captured packet: udp - Ether / IP / UDP 185.73.195.108:https > 192.168.0.103:49883 / Raw
2024-12-14 02:47:42,862 - Captured packet: udp - Ether / IP / UDP 185.73.195.108:https > 192.168.0.103:49883 / Raw
2024-12-14 02:47:42,977 - Captured packet: udp - Ether / IP / UDP 192.168.0.103:49883 > 185.73.195.108:https / Raw
2024-12-14 02:47:43,086 - Captured packet: tcp - Ether / IP / TCP 185.73.195.108:https > 192.168.0.103:52871 A
2024-12-14 02:47:43,209 - Captured packet: tcp - Ether / IP / TCP 185.73.195.108:https > 192.168.0.103:52871 A / Raw
2024-12-14 02:47:43,318 - Captured packet: tcp - Ether / IP / TCP 185.73.195.108:https > 192.168.0.103:52871 A / Raw
2024-12-14 02:47:43,428 - Captured packet: tcp - Ether / IP / TCP 192.168.0.103:52871 > 185.73.195.108:https A
2024-12-14 02:47:43,541 - Captured packet: tcp - Ether / IP / TCP 185.73.195.108:https > 192.168.0.103:52871 A / Raw
2024-12-14 02:47:43,648 - Captured packet: tcp - Ether / IP / TCP 185.73.195.108:https > 192.168.0.103:52871 PA / Raw
2024-12-14 02:47:43,757 - Captured packet: tcp - Ether / IP / TCP 192.168.0.103:52871 > 185.73.195.108:https A
2024-12-14 02:47:43,867 - Captured packet: tcp - Ether / IP / TCP 192.168.0.103:52871 > 185.73.195.108:https PA / Raw
2024-12-14 02:47:43,971 - Captured packet: udp - Ether / IP / UDP 185.73.195.108:https > 192.168.0.103:49883 / Raw
2024-12-14 02:47:44,080 - Captured packet: udp - Ether / IP / UDP 192.168.0.103:49883 > 185.73.195.108:https / Raw
2024-12-14 02:47:44,190 - Captured packet: tcp - Ether / IP / TCP 185.73.195.108:https > 192.168.0.103:52871 PA / Raw
2024-12-14 02:47:44,305 - Captured packet: tcp - Ether / IP / TCP 192.168.0.103:52871 > 185.73.195.108:https A
2024-12-14 02:47:44,414 - Captured packet: udp - Ether / IP / UDP 185.73.195.108:https > 192.168.0.103:49883 / Raw
2024-12-14 02:47:44,524 - Captured packet: udp - Ether / IP / UDP 185.73.195.108:https > 192.168.0.103:49883 / Raw
2024-12-14 02:47:44,633 - Captured packet: udp - Ether / IP / UDP 192.168.0.103:49883 > 185.73.195.108:https / Raw
2024-12-14 02:47:44,750 - Captured packet: udp - Ether / IP / UDP 192.168.0.103:49883 > 185.73.195.108:https / Raw
2024-12-14 02:47:44,859 - Captured packet: udp - Ether / IP / UDP 185.73.195.108:https > 192.168.0.103:49883 / Raw
2024-12-14 02:47:44,968 - Captured packet: udp - Ether / IP / UDP 185.73.195.108:https > 192.168.0.103:49883 / Raw
2024-12-14 02:47:45,073 - Captured packet: udp - Ether / IP / UDP 192.168.0.103:49883 > 185.73.195.108:https / Raw
2024-12-14 02:47:45,183 - Captured packet: udp - Ether / IP / UDP 192.168.0.103:49883 > 185.73.195.108:https / Raw
2024-12-14 02:47:45,292 - Captured packet: udp - Ether / IP / UDP 185.73.195.108:https > 192.168.0.103:49883 / Raw
2024-12-14 02:47:45,415 - Captured packet: udp - Ether / IP / UDP 192.168.0.103:49883 > 185.73.195.108:https / Raw
2024-12-14 02:47:45,525 - Captured packet: udp - Ether / IP / UDP 185.73.195.108:https > 192.168.0.103:49883 / Raw
2024-12-14 02:47:45,634 - Captured packet: udp - Ether / IP / UDP 192.168.0.103:49883 > 185.73.195.108:https / Raw
2024-12-14 02:47:45,770 - Captured packet: udp - Ether / IP / UDP 185.73.195.108:https > 192.168.0.103:49883 / Raw
2024-12-14 02:47:45,872 - Captured packet: udp - Ether / IP / UDP 185.73.195.108:https > 192.168.0.103:49883 / Raw
2024-12-14 02:47:45,981 - Captured packet: udp - Ether / IP / UDP 185.73.195.108:https > 192.168.0.103:49883 / Raw
2024-12-14 02:47:46,091 - Captured packet: udp - Ether / IP / UDP 185.73.195.108:https > 192.168.0.103:49883 / Raw
2024-12-14 02:47:46,198 - Captured packet: udp - Ether / IP / UDP 192.168.0.103:49883 > 185.73.195.108:https / Raw
2024-12-14 02:47:46,311 - Captured packet: udp - Ether / IP / UDP 192.168.0.103:49883 > 185.73.195.108:https / Raw
2024-12-14 02:47:46,421 - Captured packet: udp - Ether / IP / UDP 185.73.195.108:https > 192.168.0.103:49883 / Raw
2024-12-14 02:47:46,541 - Captured packet: udp - Ether / IP / UDP 185.73.195.108:https > 192.168.0.103:49883 / Raw
2024-12-14 02:47:46,651 - Captured packet: udp - Ether / IP / UDP 192.168.0.103:49883 > 185.73.195.108:https / Raw
2024-12-14 02:47:46,753 - Captured packet: udp - Ether / IP / UDP 192.168.0.103:49883 > 185.73.195.108:https / Raw
2024-12-14 02:47:46,862 - Captured packet: udp - Ether / IP / UDP 185.73.195.108:https > 192.168.0.103:49883 / Raw
2024-12-14 02:47:46,971 - Captured packet: udp - Ether / IP / UDP 185.73.195.108:https > 192.168.0.103:49883 / Raw
2024-12-14 02:47:47,086 - Captured packet: udp - Ether / IP / UDP 185.73.195.108:https > 192.168.0.103:49883 / Raw
2024-12-14 02:47:47,200 - Captured packet: udp - Ether / IP / UDP 192.168.0.103:49883 > 185.73.195.108:https / Raw
2024-12-14 02:47:47,304 - Captured packet: udp - Ether / IP / UDP 192.168.0.103:49883 > 185.73.195.108:https / Raw
2024-12-14 02:47:47,413 - Captured packet: tcp - Ether / IP / TCP 212.41.1.7:https > 192.168.0.103:51071 PA / Raw
2024-12-14 03:04:55,747 - Captured packet: tcp - Ether / IP / TCP 192.168.0.103:53059 > 74.125.205.139:https RA
2024-12-14 03:04:56,191 - Captured packet: ?? - Ether / IPv6 / ICMPv6ND_RA / ICMPv6NDOptPrefixInfo / ICMPv6NDOptRouteInfo / ICMPv6NDOptMTU / ICMPv6NDOptSrcLLAddr / ICMPv6 Neighbor Discovery Option - Recursive DNS Server Option fe80::be0f:9aff:fe24:a178
2024-12-14 03:04:56,928 - Captured packet: tcp - Ether / IP / TCP 192.168.0.103:53040 > 45.152.183.238:https A / Raw
2024-12-14 03:04:57,045 - Captured packet: tcp - Ether / IP / TCP 45.152.183.238:https > 192.168.0.103:53040 A
2024-12-14 03:04:57,310 - Captured packet: tcp - Ether / IP / TCP 192.168.0.103:53063 > 176.124.217.181:52432 S
2024-12-14 03:04:57,427 - Captured packet: tcp - Ether / IP / TCP 176.124.217.181:52432 > 192.168.0.103:53063 SA
2024-12-14 03:04:57,533 - Captured packet: tcp - Ether / IP / TCP 192.168.0.103:53063 > 176.124.217.181:52432 A
2024-12-14 03:04:57,643 - Captured packet: tcp - Ether / IP / TCP 192.168.0.103:53063 > 176.124.217.181:52432 PA / Raw
2024-12-14 03:04:57,758 - Captured packet: tcp - Ether / IP / TCP 176.124.217.181:52432 > 192.168.0.103:53063 A
2024-12-14 03:04:57,869 - Captured packet: tcp - Ether / IP / TCP 176.124.217.181:52432 > 192.168.0.103:53063 PA / Raw
2024-12-14 03:04:57,978 - Captured packet: tcp - Ether / IP / TCP 192.168.0.103:53063 > 176.124.217.181:52432 PA / Raw
2024-12-14 03:04:58,087 - Captured packet: tcp - Ether / IP / TCP 176.124.217.181:52432 > 192.168.0.103:53063 PA / Raw
2024-12-14 03:04:58,200 - Captured packet: tcp - Ether / IP / TCP 192.168.0.103:53063 > 176.124.217.181:52432 PA / Raw
2024-12-14 03:04:58,305 - Captured packet: tcp - Ether / IP / TCP 192.168.0.103:53063 > 176.124.217.181:52432 PA / Raw
2024-12-14 03:04:58,414 - Captured packet: tcp - Ether / IP / TCP 192.168.0.103:53063 > 176.124.217.181:52432 A / Raw
2024-12-14 03:04:58,532 - Captured packet: tcp - Ether / IP / TCP 192.168.0.103:53063 > 176.124.217.181:52432 PA / Raw
2024-12-14 03:04:58,658 - Captured packet: tcp - Ether / IP / TCP 192.168.0.103:53063 > 176.124.217.181:52432 PA / Raw
2024-12-14 03:04:58,765 - Captured packet: tcp - Ether / IP / TCP 176.124.217.181:52432 > 192.168.0.103:53063 A
2024-12-14 03:04:58,874 - Captured packet: tcp - Ether / IP / TCP 176.124.217.181:52432 > 192.168.0.103:53063 A
2024-12-14 03:04:58,989 - Captured packet: tcp - Ether / IP / TCP 176.124.217.181:52432 > 192.168.0.103:53063 PA / Raw
2024-12-14 03:04:59,093 - Captured packet: tcp - Ether / IP / TCP 192.168.0.103:53063 > 176.124.217.181:52432 PA / Raw
2024-12-14 03:04:59,197 - Captured packet: tcp - Ether / IP / TCP 176.124.217.181:52432 > 192.168.0.103:53063 A / Raw
2024-12-14 03:04:59,306 - Captured packet: tcp - Ether / IP / TCP 176.124.217.181:52432 > 192.168.0.103:53063 PA / Raw
2024-12-14 03:04:59,416 - Captured packet: tcp - Ether / IP / TCP 192.168.0.103:53063 > 176.124.217.181:52432 A
2024-12-14 03:04:59,538 - Captured packet: tcp - Ether / IP / TCP 176.124.217.181:52432 > 192.168.0.103:53063 PA / Raw
2024-12-14 03:04:59,647 - Captured packet: tcp - Ether / IP / TCP 192.168.0.103:53063 > 176.124.217.181:52432 PA / Raw
2024-12-14 03:04:59,756 - Captured packet: tcp - Ether / IP / TCP 192.168.0.103:53054 > 45.152.183.238:https A / Raw
2024-12-14 03:04:59,866 - Captured packet: tcp - Ether / IP / TCP 176.124.217.181:52432 > 192.168.0.103:53063 A
2024-12-14 03:04:59,982 - Captured packet: tcp - Ether / IP / TCP 45.152.183.238:https > 192.168.0.103:53054 A
2024-12-14 03:05:00,091 - Captured packet: tcp - Ether / IP / TCP 192.168.0.103:62882 > 149.154.167.50:https PA / Raw
2024-12-14 03:05:00,200 - Captured packet: tcp - Ether / IP / TCP 149.154.167.50:https > 192.168.0.103:62882 PA / Raw
2024-12-14 03:05:00,321 - Captured packet: tcp - Ether / IP / TCP 192.168.0.103:62882 > 149.154.167.50:https A
2024-12-14 03:05:00,427 - Captured packet: tcp - Ether / IP / TCP 192.168.0.103:53061 > 74.125.205.139:https PA / Raw
2024-12-14 03:05:00,536 - Captured packet: tcp - Ether / IP / TCP 192.168.0.103:53060 > 74.125.205.139:https RA
2024-12-14 03:05:00,661 - Captured packet: tcp - Ether / IP / TCP 192.168.0.103:53044 > 185.102.217.34:https A / Raw
2024-12-14 03:05:00,763 - Captured packet: tcp - Ether / IP / TCP 185.102.217.34:https > 192.168.0.103:53044 A
2024-12-14 03:05:02,557 - Captured packet: 2 - Ether / 192.168.0.1 > 224.0.0.1 2 / Raw
2024-12-14 03:05:02,679 - Captured packet: 2 - Ether / 192.168.0.1 > 228.8.8.8 2 / Raw
2024-12-14 03:05:02,788 - Captured packet: 2 - Ether / 192.168.0.103 > 239.255.255.250 2 / Raw
2024-12-14 03:05:04,554 - Captured packet: tcp - Ether / IP / TCP 192.168.0.103:53032 > 45.152.183.238:https A / Raw
2024-12-14 03:05:04,668 - Captured packet: tcp - Ether / IP / TCP 45.152.183.238:https > 192.168.0.103:53032 A
2024-12-14 03:05:04,781 - Captured packet: 2 - Ether / 192.168.0.103 > 224.0.0.251 2 / Raw
2024-12-14 03:05:04,884 - Captured packet: 2 - Ether / 192.168.0.1 > 224.0.0.2 2 / Raw
2024-12-14 03:05:04,996 - Captured packet: tcp - Ether / IP / TCP 192.168.0.103:53032 > 45.152.183.238:https A / Raw
2024-12-14 03:05:05,102 - Captured packet: tcp - Ether / IP / TCP 192.168.0.103:53032 > 45.152.183.238:https A / Raw
2024-12-14 03:05:05,210 - Captured packet: tcp - Ether / IP / TCP 192.168.0.103:53032 > 45.152.183.238:https A / Raw
2024-12-14 03:05:05,315 - Captured packet: tcp - Ether / IP / TCP 192.168.0.103:53032 > 45.152.183.238:https A / Raw
2024-12-14 03:05:05,421 - Captured packet: tcp - Ether / IP / TCP 192.168.0.103:53032 > 45.152.183.238:https PA / Raw
2024-12-14 03:05:05,541 - Captured packet: tcp - Ether / IP / TCP 192.168.0.103:53032 > 45.152.183.238:https PA / Raw
2024-12-14 03:05:05,643 - Captured packet: tcp - Ether / IP / TCP 192.168.0.103:53032 > 45.152.183.238:https PA / Raw
2024-12-14 03:05:05,757 - Captured packet: tcp - Ether / IP / TCP 192.168.0.103:53032 > 45.152.183.238:https A / Raw
2024-12-14 03:05:05,867 - Captured packet: tcp - Ether / IP / TCP 192.168.0.103:53032 > 45.152.183.238:https A / Raw
2024-12-14 03:05:05,980 - Captured packet: tcp - Ether / IP / TCP 192.168.0.103:53032 > 45.152.183.238:https A / Raw
2024-12-14 03:05:06,096 - Captured packet: tcp - Ether / IP / TCP 192.168.0.103:53032 > 45.152.183.238:https PA / Raw
2024-12-14 03:05:06,227 - Captured packet: tcp - Ether / IP / TCP 192.168.0.103:53032 > 45.152.183.238:https A / Raw
2024-12-14 03:05:06,329 - Captured packet: tcp - Ether / IP / TCP 192.168.0.103:53032 > 45.152.183.238:https PA / Raw
2024-12-14 03:05:06,431 - Captured packet: tcp - Ether / IP / TCP 45.152.183.238:https > 192.168.0.103:53032 A
2024-12-14 03:05:06,550 - Captured packet: tcp - Ether / IP / TCP 45.152.183.238:https > 192.168.0.103:53032 A
2024-12-14 03:05:06,653 - Captured packet: tcp - Ether / IP / TCP 45.152.183.238:https > 192.168.0.103:53032 PA / Raw
2024-12-14 03:05:06,764 - Captured packet: tcp - Ether / IP / TCP 45.152.183.238:https > 192.168.0.103:53032 A
2024-12-14 03:05:06,871 - Captured packet: tcp - Ether / IP / TCP 192.168.0.103:53032 > 45.152.183.238:https A
2024-12-14 03:05:06,985 - Captured packet: tcp - Ether / IP / TCP 45.152.183.238:https > 192.168.0.103:53032 A
2024-12-14 03:05:07,095 - Captured packet: tcp - Ether / IP / TCP 45.152.183.238:https > 192.168.0.103:53032 PA / Raw
2024-12-14 03:05:07,199 - Captured packet: tcp - Ether / IP / TCP 45.152.183.238:https > 192.168.0.103:53032 PA / Raw
2024-12-14 03:05:07,316 - Captured packet: tcp - Ether / IP / TCP 192.168.0.103:53032 > 45.152.183.238:https A
2024-12-14 03:05:07,421 - Captured packet: tcp - Ether / IP / TCP 192.168.0.103:53032 > 45.152.183.238:https PA / Raw
2024-12-14 03:05:07,531 - Captured packet: tcp - Ether / IP / TCP 45.152.183.238:https > 192.168.0.103:53032 A
2024-12-14 03:05:07,639 - Captured packet: tcp - Ether / IP / TCP 192.168.0.103:53064 > 45.152.183.238:https S
2024-12-14 03:05:07,757 - Captured packet: tcp - Ether / IP / TCP 45.152.183.238:https > 192.168.0.103:53032 PA / Raw
2024-12-14 03:05:07,859 - Captured packet: tcp - Ether / IP / TCP 45.152.183.238:https > 192.168.0.103:53032 A / Raw
2024-12-14 03:05:07,962 - Captured packet: tcp - Ether / IP / TCP 45.152.183.238:https > 192.168.0.103:53032 PA / Raw
2024-12-14 03:05:08,067 - Captured packet: tcp - Ether / IP / TCP 45.152.183.238:https > 192.168.0.103:53032 A / Raw
2024-12-14 03:05:08,190 - Captured packet: tcp - Ether / IP / TCP 45.152.183.238:https > 192.168.0.103:53032 A / Raw
2024-12-14 03:05:08,305 - Captured packet: tcp - Ether / IP / TCP 45.152.183.238:https > 192.168.0.103:53032 A / Raw
2024-12-14 03:05:08,408 - Captured packet: tcp - Ether / IP / TCP 192.168.0.103:53032 > 45.152.183.238:https A
2024-12-14 03:05:08,519 - Captured packet: tcp - Ether / IP / TCP 45.152.183.238:https > 192.168.0.103:53032 A / Raw
2024-12-14 03:05:08,624 - Captured packet: tcp - Ether / IP / TCP 45.152.183.238:https > 192.168.0.103:53032 A / Raw
2024-12-14 03:05:08,738 - Captured packet: tcp - Ether / IP / TCP 45.152.183.238:https > 192.168.0.103:53032 PA / Raw
2024-12-14 03:05:08,848 - Captured packet: tcp - Ether / IP / TCP 192.168.0.103:53032 > 45.152.183.238:https A
2024-12-14 03:05:08,953 - Captured packet: tcp - Ether / IP / TCP 45.152.183.238:https > 192.168.0.103:53064 SA
2024-12-14 03:05:09,068 - Captured packet: tcp - Ether / IP / TCP 192.168.0.103:53064 > 45.152.183.238:https A
2024-12-14 03:05:09,170 - Captured packet: tcp - Ether / IP / TCP 192.168.0.103:53064 > 45.152.183.238:https A / Raw
2024-12-14 03:05:09,279 - Captured packet: tcp - Ether / IP / TCP 192.168.0.103:53064 > 45.152.183.238:https PA / Raw
2024-12-14 03:05:09,390 - Captured packet: tcp - Ether / IP / TCP 192.168.0.103:53032 > 45.152.183.238:https A / Raw
2024-12-14 03:05:09,501 - Captured packet: tcp - Ether / IP / TCP 192.168.0.103:53032 > 45.152.183.238:https A / Raw
2024-12-14 03:05:09,604 - Captured packet: tcp - Ether / IP / TCP 192.168.0.103:53032 > 45.152.183.238:https A / Raw
2024-12-14 03:05:09,719 - Captured packet: tcp - Ether / IP / TCP 192.168.0.103:53032 > 45.152.183.238:https A / Raw
2024-12-14 03:05:09,821 - Captured packet: tcp - Ether / IP / TCP 192.168.0.103:53032 > 45.152.183.238:https A / Raw
2024-12-14 03:05:09,922 - Captured packet: tcp - Ether / IP / TCP 192.168.0.103:53032 > 45.152.183.238:https A / Raw
2024-12-14 03:05:10,038 - Captured packet: tcp - Ether / IP / TCP 192.168.0.103:53032 > 45.152.183.238:https PA / Raw
2024-12-14 03:05:10,140 - Captured packet: tcp - Ether / IP / TCP 192.168.0.103:53032 > 45.152.183.238:https A / Raw
2024-12-14 03:05:10,250 - Captured packet: tcp - Ether / IP / TCP 192.168.0.103:53032 > 45.152.183.238:https PA / Raw
2024-12-14 03:05:10,360 - Captured packet: tcp - Ether / IP / TCP 45.152.183.238:https > 192.168.0.103:53064 A
2024-12-14 03:05:10,470 - Captured packet: tcp - Ether / IP / TCP 45.152.183.238:https > 192.168.0.103:53064 A
2024-12-14 03:05:10,583 - Captured packet: tcp - Ether / IP / TCP 45.152.183.238:https > 192.168.0.103:53032 A
2024-12-14 03:05:10,693 - Captured packet: tcp - Ether / IP / TCP 45.152.183.238:https > 192.168.0.103:53032 A
2024-12-14 03:05:10,807 - Captured packet: tcp - Ether / IP / TCP 45.152.183.238:https > 192.168.0.103:53064 A / Raw
2024-12-14 03:05:10,921 - Captured packet: tcp - Ether / IP / TCP 45.152.183.238:https > 192.168.0.103:53064 PA / Raw
2024-12-14 03:05:11,024 - Captured packet: tcp - Ether / IP / TCP 192.168.0.103:53064 > 45.152.183.238:https A
2024-12-14 03:05:11,140 - Captured packet: tcp - Ether / IP / TCP 192.168.0.103:53064 > 45.152.183.238:https PA / Raw
2024-12-14 03:05:11,254 - Captured packet: tcp - Ether / IP / TCP 45.152.183.238:https > 192.168.0.103:53064 PA / Raw
2024-12-14 03:05:11,368 - Captured packet: tcp - Ether / IP / TCP 192.168.0.103:53064 > 45.152.183.238:https PA / Raw
2024-12-14 03:05:11,475 - Captured packet: 2 - Ether / 192.168.0.103 > 224.0.0.252 2 / Raw
2024-12-14 03:05:11,591 - Captured packet: tcp - Ether / IP / TCP 192.168.0.103:53032 > 45.152.183.238:https A / Raw
2024-12-14 03:05:11,707 - Captured packet: tcp - Ether / IP / TCP 192.168.0.103:53032 > 45.152.183.238:https A / Raw
2024-12-14 03:05:11,821 - Captured packet: tcp - Ether / IP / TCP 192.168.0.103:53032 > 45.152.183.238:https A / Raw
2024-12-14 03:05:11,925 - Captured packet: tcp - Ether / IP / TCP 192.168.0.103:53032 > 45.152.183.238:https PA / Raw
2024-12-14 03:05:12,034 - Captured packet: tcp - Ether / IP / TCP 192.168.0.103:53032 > 45.152.183.238:https A / Raw
2024-12-14 03:05:12,140 - Captured packet: tcp - Ether / IP / TCP 192.168.0.103:53032 > 45.152.183.238:https PA / Raw
2024-12-14 03:05:12,245 - Captured packet: tcp - Ether / IP / TCP 45.152.183.238:https > 192.168.0.103:53064 PA / Raw
2024-12-14 03:05:12,356 - Captured packet: tcp - Ether / IP / TCP 192.168.0.103:53064 > 45.152.183.238:https A / Raw
2024-12-14 03:05:12,479 - Captured packet: tcp - Ether / IP / TCP 192.168.0.103:53064 > 45.152.183.238:https PA / Raw
2024-12-14 03:05:12,587 - Captured packet: tcp - Ether / IP / TCP 192.168.0.103:53040 > 45.152.183.238:https PA / Raw
2024-12-14 03:05:12,688 - Captured packet: tcp - Ether / IP / TCP 192.168.0.103:53040 > 45.152.183.238:https PA / Raw
2024-12-14 03:05:12,801 - Captured packet: tcp - Ether / IP / TCP 192.168.0.103:53040 > 45.152.183.238:https PA / Raw
2024-12-14 03:05:12,912 - Captured packet: tcp - Ether / IP / TCP 45.152.183.238:https > 192.168.0.103:53032 A
2024-12-14 03:05:13,013 - Captured packet: tcp - Ether / IP / TCP 45.152.183.238:https > 192.168.0.103:53032 A
2024-12-14 03:05:13,119 - Captured packet: tcp - Ether / IP / TCP 45.152.183.238:https > 192.168.0.103:53064 A
2024-12-14 03:05:13,221 - Captured packet: tcp - Ether / IP / TCP 45.152.183.238:https > 192.168.0.103:53040 A
2024-12-14 03:05:13,324 - Captured packet: tcp - Ether / IP / TCP 45.152.183.238:https > 192.168.0.103:53040 A
2024-12-14 03:05:13,425 - Captured packet: tcp - Ether / IP / TCP 45.152.183.238:https > 192.168.0.103:53040 A
2024-12-14 03:05:13,529 - Captured packet: tcp - Ether / IP / TCP 45.152.183.238:https > 192.168.0.103:53040 PA / Raw
2024-12-14 03:05:13,652 - Captured packet: tcp - Ether / IP / TCP 45.152.183.238:https > 192.168.0.103:53064 A / Raw
2024-12-14 03:05:13,756 - Captured packet: tcp - Ether / IP / TCP 45.152.183.238:https > 192.168.0.103:53064 A / Raw
2024-12-14 03:05:13,860 - Captured packet: tcp - Ether / IP / TCP 45.152.183.238:https > 192.168.0.103:53064 A / Raw
2024-12-14 03:05:13,975 - Captured packet: tcp - Ether / IP / TCP 192.168.0.103:53064 > 45.152.183.238:https A
2024-12-14 03:05:14,078 - Captured packet: tcp - Ether / IP / TCP 45.152.183.238:https > 192.168.0.103:53064 A / Raw
2024-12-14 03:05:14,184 - Captured packet: tcp - Ether / IP / TCP 192.168.0.103:53064 > 45.152.183.238:https A
2024-12-14 03:05:14,294 - Captured packet: tcp - Ether / IP / TCP 45.152.183.238:https > 192.168.0.103:53064 PA / Raw
2024-12-14 03:05:14,399 - Captured packet: tcp - Ether / IP / TCP 192.168.0.103:53064 > 45.152.183.238:https PA / Raw
2024-12-14 03:05:14,508 - Captured packet: tcp - Ether / IP / TCP 192.168.0.103:53064 > 45.152.183.238:https PA / Raw
2024-12-14 03:05:14,609 - Captured packet: tcp - Ether / IP / TCP 192.168.0.103:53064 > 45.152.183.238:https PA / Raw
2024-12-14 03:05:14,711 - Captured packet: tcp - Ether / IP / TCP 192.168.0.103:53064 > 45.152.183.238:https PA / Raw
2024-12-14 03:05:14,816 - Captured packet: tcp - Ether / IP / TCP 45.152.183.238:https > 192.168.0.103:53040 PA / Raw
2024-12-14 03:05:14,922 - Captured packet: tcp - Ether / IP / TCP 192.168.0.103:53040 > 45.152.183.238:https A
2024-12-14 03:05:15,027 - Captured packet: tcp - Ether / IP / TCP 192.168.0.103:53040 > 45.152.183.238:https PA / Raw
2024-12-14 03:05:15,130 - Captured packet: tcp - Ether / IP / TCP 45.152.183.238:https > 192.168.0.103:53032 PA / Raw
2024-12-14 03:05:15,246 - Captured packet: tcp - Ether / IP / TCP 45.152.183.238:https > 192.168.0.103:53032 PA / Raw
2024-12-14 03:05:15,347 - Captured packet: tcp - Ether / IP / TCP 192.168.0.103:53032 > 45.152.183.238:https A
2024-12-14 03:05:15,460 - Captured packet: tcp - Ether / IP / TCP 45.152.183.238:https > 192.168.0.103:53064 A
2024-12-14 03:05:15,564 - Captured packet: tcp - Ether / IP / TCP 45.152.183.238:https > 192.168.0.103:53064 A
2024-12-14 03:05:15,676 - Captured packet: tcp - Ether / IP / TCP 45.152.183.238:https > 192.168.0.103:53064 PA / Raw
2024-12-14 03:05:15,777 - Captured packet: tcp - Ether / IP / TCP 45.152.183.238:https > 192.168.0.103:53064 PA / Raw
2024-12-14 03:05:15,884 - Captured packet: tcp - Ether / IP / TCP 192.168.0.103:53064 > 45.152.183.238:https A
2024-12-14 03:05:15,986 - Captured packet: tcp - Ether / IP / TCP 192.168.0.103:53064 > 45.152.183.238:https PA / Raw
2024-12-14 03:05:16,091 - Captured packet: tcp - Ether / IP / TCP 45.152.183.238:https > 192.168.0.103:53040 A
2024-12-14 03:05:16,199 - Captured packet: tcp - Ether / IP / TCP 45.152.183.238:https > 192.168.0.103:53064 A / Raw
2024-12-14 03:05:16,310 - Captured packet: tcp - Ether / IP / TCP 45.152.183.238:https > 192.168.0.103:53064 A / Raw
2024-12-14 03:05:16,412 - Captured packet: tcp - Ether / IP / TCP 192.168.0.103:53064 > 45.152.183.238:https A
2024-12-14 03:05:16,525 - Captured packet: tcp - Ether / IP / TCP 45.152.183.238:https > 192.168.0.103:53064 A / Raw
2024-12-14 03:05:16,627 - Captured packet: tcp - Ether / IP / TCP 45.152.183.238:https > 192.168.0.103:53064 PA / Raw
2024-12-14 03:05:16,744 - Captured packet: tcp - Ether / IP / TCP 192.168.0.103:53064 > 45.152.183.238:https A
2024-12-14 03:05:16,848 - Captured packet: tcp - Ether / IP / TCP 45.152.183.238:https > 192.168.0.103:53064 PA / Raw
2024-12-14 03:05:16,952 - Captured packet: tcp - Ether / IP / TCP 192.168.0.103:53064 > 45.152.183.238:https A
2024-12-14 03:05:17,058 - Captured packet: tcp - Ether / IP / TCP 45.152.183.238:https > 192.168.0.103:53064 A
2024-12-14 03:05:17,166 - Captured packet: tcp - Ether / IP / TCP 45.152.183.238:https > 192.168.0.103:53032 PA / Raw
2024-12-14 03:05:17,269 - Captured packet: tcp - Ether / IP / TCP 45.152.183.238:https > 192.168.0.103:53032 PA / Raw
2024-12-14 03:05:17,383 - Captured packet: tcp - Ether / IP / TCP 192.168.0.103:53032 > 45.152.183.238:https A
2024-12-14 03:05:17,486 - Captured packet: tcp - Ether / IP / TCP 45.152.183.238:https > 192.168.0.103:53032 PA / Raw
2024-12-14 03:05:17,587 - Captured packet: tcp - Ether / IP / TCP 192.168.0.103:53032 > 45.152.183.238:https A
2024-12-14 03:05:17,695 - Captured packet: tcp - Ether / IP / TCP 45.152.183.238:https > 192.168.0.103:53032 PA / Raw
2024-12-14 03:05:17,812 - Captured packet: tcp - Ether / IP / TCP 192.168.0.103:53032 > 45.152.183.238:https A / Raw
2024-12-14 03:05:17,920 - Captured packet: tcp - Ether / IP / TCP 192.168.0.103:53032 > 45.152.183.238:https A / Raw
2024-12-14 03:05:18,028 - Captured packet: tcp - Ether / IP / TCP 192.168.0.103:53032 > 45.152.183.238:https A / Raw
2024-12-14 03:05:18,129 - Captured packet: tcp - Ether / IP / TCP 192.168.0.103:53032 > 45.152.183.238:https PA / Raw
2024-12-14 03:05:18,231 - Captured packet: tcp - Ether / IP / TCP 192.168.0.103:53032 > 45.152.183.238:https A / Raw
2024-12-14 03:05:18,336 - Captured packet: tcp - Ether / IP / TCP 192.168.0.103:53032 > 45.152.183.238:https PA / Raw
2024-12-14 03:05:18,446 - Captured packet: tcp - Ether / IP / TCP 45.152.183.238:https > 192.168.0.103:53032 PA / Raw
2024-12-14 03:05:18,549 - Captured packet: tcp - Ether / IP / TCP 45.152.183.238:https > 192.168.0.103:53032 A
2024-12-14 03:05:18,652 - Captured packet: tcp - Ether / IP / TCP 192.168.0.103:53032 > 45.152.183.238:https A
2024-12-14 03:05:18,753 - Captured packet: tcp - Ether / IP / TCP 45.152.183.238:https > 192.168.0.103:53032 A
2024-12-14 03:05:18,873 - Captured packet: tcp - Ether / IP / TCP 45.152.183.238:https > 192.168.0.103:53032 PA / Raw
2024-12-14 03:05:18,982 - Captured packet: tcp - Ether / IP / TCP 192.168.0.103:53032 > 45.152.183.238:https A
2024-12-14 03:05:19,095 - Captured packet: tcp - Ether / IP / TCP 192.168.0.103:53040 > 45.152.183.238:https PA / Raw
2024-12-14 03:05:19,198 - Captured packet: tcp - Ether / IP / TCP 192.168.0.103:53040 > 45.152.183.238:https PA / Raw
2024-12-14 03:05:19,302 - Captured packet: tcp - Ether / IP / TCP 45.152.183.238:https > 192.168.0.103:53032 PA / Raw
2024-12-14 03:05:19,408 - Captured packet: tcp - Ether / IP / TCP 45.152.183.238:https > 192.168.0.103:53032 PA / Raw
2024-12-14 03:05:19,523 - Captured packet: tcp - Ether / IP / TCP 192.168.0.103:53032 > 45.152.183.238:https A
2024-12-14 03:05:19,634 - Captured packet: tcp - Ether / IP / TCP 45.152.183.238:https > 192.168.0.103:53040 A
2024-12-14 03:05:19,747 - Captured packet: tcp - Ether / IP / TCP 45.152.183.238:https > 192.168.0.103:53032 PA / Raw
2024-12-14 03:05:19,849 - Captured packet: tcp - Ether / IP / TCP 45.152.183.238:https > 192.168.0.103:53040 A
2024-12-14 03:05:19,955 - Captured packet: tcp - Ether / IP / TCP 192.168.0.103:53032 > 45.152.183.238:https A
2024-12-14 03:05:20,058 - Captured packet: tcp - Ether / IP / TCP 45.152.183.238:https > 192.168.0.103:53040 PA / Raw
2024-12-14 03:05:20,166 - Captured packet: tcp - Ether / IP / TCP 192.168.0.103:53040 > 45.152.183.238:https A
2024-12-14 03:05:20,279 - Captured packet: tcp - Ether / IP / TCP 45.152.183.238:https > 192.168.0.103:53032 PA / Raw
2024-12-14 03:05:20,386 - Captured packet: tcp - Ether / IP / TCP 192.168.0.103:53032 > 45.152.183.238:https A
2024-12-14 03:05:20,497 - Captured packet: tcp - Ether / IP / TCP 45.152.183.238:https > 192.168.0.103:53032 PA / Raw
2024-12-14 03:05:20,599 - Captured packet: tcp - Ether / IP / TCP 192.168.0.103:53032 > 45.152.183.238:https A
